{
  "fixture_version": 2,
  "fixture_kind": "authored_contract_examples",
  "description": "Hand-authored static examples used only for deterministic offline contract regression checks.",
  "provenance": {
    "authoring_method": "manually_authored_and_reviewed",
    "generated_by_skill": false,
    "independent": false,
    "created_at": "2026-07-11",
    "purpose": "Verify that repository contracts and evidence-handling assertions continue to behave deterministically offline.",
    "limitations": [
      "The examples were authored alongside the assertions and are not independent test outputs.",
      "No Skill or language model is executed and runtime Skill triggering is not tested.",
      "Passing these contracts does not predict rankings, traffic, leads, revenue, or other SEO outcomes.",
      "Public-source snapshots are dated excerpts and require periodic refresh against the live documents."
    ]
  },
  "sources": {
    "google-ai-optimization-guide": {
      "source_type": "public_web",
      "locator": "https://developers.google.com/search/docs/fundamentals/ai-optimization-guide?hl=en",
      "title": "Succeeding in AI search experiences on Google",
      "snapshot": {
        "status": "captured",
        "captured_at": "2026-07-11",
        "http_status": 200,
        "excerpt": "LLMS.txt files and other special markup: You don't need to create new machine readable files, AI text files, markup, or Markdown to appear in Google Search (including its generative AI capabilities), as Google Search itself doesn't use them. Doing so will neither harm nor help your site's visibility or rankings in Google Search, as Google Search ignores them.",
        "supports": {
          "llms-txt": {
            "claim": "Google Search does not use llms.txt files and ignores them",
            "excerpt": "Google Search itself doesn't use them"
          }
        }
      }
    },
    "google-indexing-api": {
      "source_type": "public_web",
      "locator": "https://developers.google.com/search/apis/indexing-api/v3/using-api",
      "title": "Using the Indexing API",
      "snapshot": {
        "status": "captured",
        "captured_at": "2026-07-11",
        "http_status": 200,
        "excerpt": "The Indexing API can only be used to crawl pages with either JobPosting or BroadcastEvent embedded in a VideoObject.",
        "supports": {
          "indexing-api": {
            "claim": "The Google Indexing API can only be used for pages with JobPosting or BroadcastEvent embedded in a VideoObject",
            "excerpt": "can only be used to crawl pages with either JobPosting or BroadcastEvent embedded in a VideoObject"
          }
        }
      }
    },
    "google-search-updates": {
      "source_type": "public_web",
      "locator": "https://developers.google.com/search/updates",
      "title": "Google Search documentation updates",
      "snapshot": {
        "status": "captured",
        "captured_at": "2026-07-11",
        "http_status": 200,
        "excerpt": "FAQ: This feature will no longer appear in Google Search starting May 7, 2026. How-to: Removed the How-to structured data documentation, as this rich result is no longer shown in search results, on both desktop and mobile devices.",
        "supports": {
          "faq-retired": {
            "claim": "The FAQ rich result no longer appears in Google Search as of May 7, 2026",
            "excerpt": "This feature will no longer appear in Google Search starting May 7, 2026"
          },
          "howto-retired": {
            "claim": "Google's How-to rich result is no longer shown in desktop or mobile search results",
            "excerpt": "this rich result is no longer shown in search results, on both desktop and mobile devices"
          }
        }
      }
    },
    "google-title-links": {
      "source_type": "public_web",
      "locator": "https://developers.google.com/search/docs/appearance/title-link",
      "title": "Influencing title links in Google Search",
      "snapshot": {
        "status": "captured",
        "captured_at": "2026-07-11",
        "http_status": 200,
        "excerpt": "While there's no limit on how long a title element can be, the title link is truncated in Google Search results as needed, typically to fit the device width.",
        "supports": {
          "title-meta-length": {
            "claim": "There is no limit on how long a title element can be",
            "excerpt": "no limit on how long a title element can be"
          }
        }
      }
    },
    "google-snippets": {
      "source_type": "public_web",
      "locator": "https://developers.google.com/search/docs/appearance/snippet",
      "title": "Control your snippets in search results",
      "snapshot": {
        "status": "captured",
        "captured_at": "2026-07-11",
        "http_status": 200,
        "excerpt": "There's no limit on how long a meta description can be, but the snippet is truncated in Google Search results as needed, typically to fit the device width.",
        "supports": {
          "title-meta-length": {
            "claim": "There is no limit on how long a meta description can be",
            "excerpt": "no limit on how long a meta description can be"
          }
        }
      }
    },
    "google-extended-doc": {
      "source_type": "public_web",
      "locator": "https://developers.google.com/search/docs/crawling-indexing/google-common-crawlers#google-extended",
      "title": "Google-Extended product token",
      "snapshot": {
        "status": "captured",
        "captured_at": "2026-07-11",
        "http_status": 200,
        "excerpt": "Google-Extended does not impact a site's inclusion in Google Search nor is it used as a ranking signal in Google Search.",
        "supports": {
          "google-extended": {
            "claim": "Google-Extended does not affect a site's inclusion in Google Search and is not a Google Search ranking signal",
            "excerpt": "does not impact a site's inclusion in Google Search nor is it used as a ranking signal in Google Search"
          }
        }
      }
    },
    "google-structured-data-policies": {
      "source_type": "public_web",
      "locator": "https://developers.google.com/search/docs/appearance/structured-data/sd-policies",
      "title": "General structured data guidelines",
      "snapshot": {
        "status": "captured",
        "captured_at": "2026-07-11",
        "http_status": 200,
        "excerpt": "Structured data is eligible for appearance as a rich result; it doesn't affect how the page ranks in Google web search. Google does not guarantee that your structured data will show up in search results, even if your page is marked up correctly according to the Rich Results Test.",
        "supports": {
          "schema-eligibility": {
            "claim": "Structured data can make a page eligible for a rich result but does not guarantee appearance or affect web ranking",
            "excerpt": "Google does not guarantee that your structured data will show up in search results"
          }
        }
      }
    },
    "fixture-material-datasheet": {
      "source_type": "provided_data",
      "locator": "fixture://vibio-content/material-datasheet-row",
      "title": "Synthetic user-provided material datasheet row",
      "snapshot": {
        "status": "captured",
        "captured_at": "2026-07-11",
        "excerpt": "Hand-authored input fixture: candidate material CF-01; density 1.8 g/cm3; value supplied only to test source handling.",
        "supports": {
          "fiber-density": {
            "claim": "The example material datasheet records a candidate density of 1.8 g/cm3",
            "excerpt": "candidate material CF-01; density 1.8 g/cm3"
          }
        }
      }
    },
    "fixture-gsc-export": {
      "source_type": "provided_data",
      "locator": "fixture://vibio-review/gsc-monthly-export",
      "title": "Synthetic GSC export row",
      "snapshot": {
        "status": "captured",
        "captured_at": "2026-07-11",
        "excerpt": "Hand-authored GSC export fixture for the monthly review case: organic clicks = 842.",
        "supports": {
          "gsc-clicks": {
            "claim": "The hand-authored GSC export fixture records 842 clicks",
            "excerpt": "organic clicks = 842"
          }
        }
      }
    },
    "fixture-crm-export": {
      "source_type": "provided_data",
      "locator": "fixture://vibio-review/crm-monthly-export",
      "title": "Synthetic CRM export row",
      "snapshot": {
        "status": "captured",
        "captured_at": "2026-07-11",
        "excerpt": "Hand-authored CRM export fixture for the monthly review case: qualified leads = 12.",
        "supports": {
          "qualified-leads": {
            "claim": "The hand-authored CRM export fixture records 12 qualified leads",
            "excerpt": "qualified leads = 12"
          }
        }
      }
    }
  },
  "responses": {
    "vibio-audit:1": "先读取项目记忆、代码配置和构建产物；抽查模板代码和渲染 HTML。每项发现记录观察证据、适用官方规则、业务影响、置信度、修复负责人及验证步骤。外部能力缺失时以本地文件和导出材料降级，未测指标保持 unknown，不得虚构流量或排名。",
    "vibio-audit:2": {
      "facts": [
        "input_is_url_only",
        "network_observation_required",
        "unobserved_fields_remain_unknown",
        "llms_txt_not_google_requirement"
      ],
      "measurement": {
        "unobserved_value_policy": "unknown"
      },
      "next_observations": ["rendered_html", "robots_txt", "sitemap_xml", "status_codes"]
    },
    "vibio-audit:3": "诊断顺序是先验证可抓取与可索引资格，再观察目标 SERP 的意图与页型，然后检查信息增益、一手证据和内链。所有未观察到的原因都标成待验证假设，不凭内容长度下结论。",
    "vibio-audit:4": "读取项目记忆并对代表性模板做有边界抽查。seo-* 不可用时使用本地构建、sitemap、robots 和导出数据 fallback；报告分开观察事实与假设，引用官方规则，最后写回项目记忆并登记后续复盘条件。",
    "vibio-audit:5": "风险测试针对 scaled content abuse：查看是否主要为操纵排名、是否缺少原创贡献，并抽样核验页面价值。引用 https://developers.google.com/search/docs/essentials/spam-policies 。AI 的使用本身不决定合规性，结论按实际行为和页面证据给出。",

    "vibio-content:1": {
      "facts": [